203;Baixa frequência da ronda policial.
204;Baixa iluminação na zona rural aumentando a violência.
205;Baixa infraestrutura produtiva para o homem do campo (equipamentos e agroindústrias).
206;Baixa inserção dos produtos da agricultura familiar nos programas de compras governamentais.
207;Baixa integração das políticas de prevenção para aproximação da sociedade (in loco).
208;Baixa integração dos equipamentos da área da Justiça e Município.
209;Baixa integração dos órgãos públicos e sociedade civil para o desenvolvimento da cadeia produtiva agropecuária.
210;Baixa integração entre as prefeituras, perdendo força para atração de investimentos.
211;Baixa intersetorialidade das políticas públicas da rede socioassistencial, segurança, saúde, educação, emprego e renda.
212;Baixa oferta de cursos profissionalizantes gratuitos.
213;Baixa oferta de empregos e geração de renda.
214;Baixa oferta de produtos em quantidade, qualidade e diversidade que assegurem garantia alimentar e nutricional.
215;Baixa oferta de profissionais na área de saúde da região.
216;Baixa oferta de vagas para educação infantil.
217;Baixa organização das diferentes cadeias produtivas (desde a produção até a comercialização).
218;Baixa permanência dos juízes, promotores e defensores públicos nos municípios.
219;Baixa produtividade do trabalho devido ao padrão tecnológico rudimentar.
220;Baixa qualidade das energias ofertadas da zona rural.
221;Baixa qualidade do ensino fundamental.
222;Baixa qualidade do ensino nas escolas públicas.
223;Baixa qualidade dos profissionais escolares no atendimento a pessoas com deficiência.
224;Baixa qualidade na Educação.
225;Baixa qualidade na inclusão dos PCD na sociedade (estrutura dos equipamentos públicos e qualificação dos profissionais).
226;Baixa qualificação da mão de obra devido à oferta insuficiente de cursos de capacitação em todos os setores da economia.
227;Baixa qualificação da mão de obra em geral.
228;Baixa qualificação da mão de obra, aumentando a informalidade.
229;Baixa qualificação de operadores no setor turístico e dos demais setores (trabalhadores acima de 40 anos).
230;Baixa qualificação na mão de obra para o trabalho na indústria.
231;Baixa remuneração dos produtos da agricultura familiar.
232;Baixa resolutividade na atenção de média e alta complexidade.
387;Deficiência das estruturas físicas e de equipamentos para a pesca e apicultura.
388;Deficiência das vias de acesso entre os espaços rurais e urbanos (rodovias estaduais e estradas vicinais) para o escoamento da produção.
389;Deficiência de capacitação dos gestores públicos para gestão estratégica.
390;Deficiência de emprego.
391;Deficiência de espaços para comercialização e realização de feiras e eventos.
392;Deficiência de estratégias inovadoras e pesquisas agropecuárias e aquícolas para geração de renda no meio rural.
393;Deficiência de mobilidade dos produtores e produção entre o meio rural e urbano.
394;Deficiência de políticas públicas que garanta o desenvolvimento econômico, social e ambiental nos assentamentos e produtores da região.
395;Deficiência de programas e projetos para utilização dos recursos hídricos nos meios de produção.
396;Deficiência de recursos voltados para a educação infantil.
397;Deficiência de sinalização nas vias de acesso aos pontos turísticas da região.
398;Deficiência de um tratamento multiprofissional do serviço especializado, no atendimento aos pacientes portadores de hemoglobinopatia e coagulopatias.
399;Deficiência do sistema de saneamento básico.
400;Deficiência dos campos de várzea.
401;Deficiência e descontinuidade da oferta de Ater na região.
402;Deficiência e ineficiência da segurança nas escolas públicas.
403;Deficiência em assistência técnica rural- ATER, assistência técnica na pesca e aquicultura- ATEPA de forma continuada e de qualidade.
404;Deficiência em políticas públicas de comercialização dos produtos agrícolas.
405;Deficiência em políticas públicas de qualificação para a produção agropecuária (produtores e população em geral).
406;Deficiência na aplicação dos protocolos por parte dos profissionais da saúde.
407;Deficiência na assistência ao idoso.
408;Deficiência na atração de indústrias e agroindústrias para região.
409;Deficiência na capacitação dos agentes de segurança (descontinuidade).
410;Deficiência na capacitação empreendedora.
411;Deficiência na contratação de agentes comunitários de saúde.
412;Deficiência na estrutura para produção de farinha e cajucultura.
413;Deficiência na exploração do potencial turístico da região.
414;Deficiência na gestão do transporte escolar.
415;Deficiência na gestão escolar.
416;Deficiência na gestão hídrica.
417;Deficiência na identificação de vocações e oportunidades da região.
418;Deficiência na infraestrutura escolar.
419;Deficiência na intersetorialidade de políticas do Ceará do Conhecimento.
420;Deficiência na mobilidade urbana inclusive noturna.
421;Deficiência na política voltada para atração de investimentos e geração de emprego e renda para fomentar no mercado de trabalho.
422;Deficiência na qualificação dos agentes de Ater, da mão de obra rural e das organizações.
423;Deficiência na titularidade da terra.
424;Deficiência no acesso gratuito à justiça.
425;Deficiência no aproveitamento das vocações turísticas da região (divulgação, rotas turísticas, integração entre os municípios, aparelhamento, dentre outros).
426;Deficiência no atendimento do Samu.
427;Deficiência no atendimento terciário e especializado para idosos.
428;Deficiência no dimensionamento e posicionamento estratégico das atividades agropecuárias para as economias dos municípios da região.
429;Deficiência no enfrentamento da violência contra a mulher.
430;Deficiência no mapeamento e divulgação dos pontos turísticos da região.
431;Deficiência no sistema de saneamento básico.
432;Deficiência nos canais de escoamento da produção.
433;Deficiência nos projetos habitacionais da zona urbana e rural.
434;Deficiência ou ausência da educação empreendedora na educação formal.
435;Deficiência por parte dos órgãos responsáveis por programas de acesso a terra e regularização fundiária e do Cadastro Ambiental Rural dos Assentamentos Estaduais, sobretudo para povos e comunidades tradicionais (PCTs).
436;Deficiência, descontinuidade e ineficiência de assistência técnica e extensão rural.
437;Deficiências nas políticas, não atendendo às reais demandas da população.
438;Degradação ambiental crescente, principalmente no Açude do Jaburu 1.
439;Degradação das nascentes e matas ciliares.
440;Degradação das vias de acesso entre campo e cidade dificultando o escoamento da produção e mobilidade das pessoas na prestação de serviços.
441;Degradação do espaço público e natural devido ao elevado fluxo do turismo.
442;Demanda reprimida por cirurgias eletivas.
443;Demora excessiva no diagnóstico de doença (demora na marcação de exames).
444;Demora na conclusão da escola profissionalizante de limoeiro do norte.
445;Demora na resolução das causas judiciais
446;Demora na tramitação dos processos judiciais.
447;Dependência de apenas uma matriz energética.
448;Desalinhamento das escolhas dos cursos superiores com a necessidade local.
449;Desalinhamento entre projetos de cultura e a comunidade.
450;Desarticulação das políticas públicas gerando a criação de elefantes brancos.
451;Desarticulação entre os governos estadual e municipal para captação de projetos.
452;Desarticulação entre os municípios, políticas públicas e instituições para o desenvolvimento regional
453;Desatualização do Plano de Bacias (Acaraú e Coreaú).
454;Desatualização e defasagem do plano de mobilização urbana da região.
455;Descarte inadequado de resíduos sólidos e ineficácia de fiscalização desse descarte.
456;Descaso com a população referente à titularização das suas propriedades em áreas de assentamentos e reassentamentos.
457;Desconexão entre a política industrial e a universidade.
853;Fiscalização inadequada na ocupação de territórios.
854;Fiscalização ineficaz do meio ambiente.
855;Fiscalização insuficiente dos recursos hídricos.
856;Fluxo de jovens saindo do campo para centros urbanos em busca de trabalho.
857;Formação continuada dos profissionais insuficiente.
858;Formação de professores insuficiente.
859;Formação dos profissionais não adequada para enfrentar os problemas sociais (violência).
860;Formação e qualificação dos professores ineficientes.
861;Formação profissional distante dos arranjos produtivos locais.
862;Fornecimento de alimentos que apesar de ser de baixo custo é de baixa qualidade.
863;Forte indicação política dos gestores públicos.
864;Fracasso escolar no ensino-aprendizagem: evasão, abandono.
865;Fragilidade da assistência farmacêutico com foco das distribuição de medicamentos.
866;Fragilidade da rede de proteção social especial de alta complexidade.
867;Fragilidade da regularização de política de aquisição de alimentos (insuficiência de recursos).
868;Fragilidade das políticas públicas de promoção e prevenção à saúde.
869;Fragilidade das políticas voltadas para mulheres vítimas de violência na região.
870;Fragilidade de empoderamento do papel dos comitês de bacias hidrográficas.
871;Fragilidade de estratégia dos programas de proteção às crianças e adolescentes ameaçadas.
872;Fragilidade de implementação do programa de transferências de renda (beneficiário fora de perfil).
873;Fragilidade dos equipamentos de segurança nos distritos.
875;Fragilidade dos vínculos familiares.
876;Fragilidade na atenção mental.
877;Fragilidade na educação ambiental.
878;Fragilidade na fiscalização do programa Garantia Safra.
879;Fragilidade na intersetorialidade das políticas públicas de meio ambiente.
880;Fragilidade na política de educação permanente em saúde.
881;Fragilidade na qualificação dos produtores para o uso de novas técnicas.
882;Fragilidade na rede de atenção à saúde.
883;Fragilidade quanto à acessibilidade para os mais vulneráveis, em especial, idosos e pessoas com deficiência.
884;Fragmentação das políticas de saúde, dificultando o acesso aos serviços indispensáveis.
885;Fragmentação das políticas públicas educacionais.
886;Fragmentação das políticas públicas.
887;Fragmentação e descontinuidade das políticas para reinserção dos egressos do sistema prisional e socioeducativo.
888;Funcionamento precário dos Centros Vocacionais Tecnológicos (CVT).
889;Funcionamento precário no hospital maternidade da região.
890;Fácil acesso de jovens e adolescentes ao uso de substâncias psicoativas.
891;Gestão escolar ineficiente (lotação política).
892;Gestão inadequada das políticas de utilização dos recursos hídricos.
893;Grande contaminação dos recursos hídricos por conta da política ineficaz.
894;Grande número de crianças e adolescente envolvidos com facções.
895;Grande número de famílias extremamente pobres, sem possibilidade de ascensão e garantia de direitos e sem acesso aos serviços essenciais básicos.
896;Grandes investimentos em Jericoacoara em detrimento de outros municípios da região.
897;Há uma deficiente relação entre escola e comunidade.
898;Iluminação pública deficiente.
899;Inacessibilidade da população rural ao programa Minha Casa Minha Vida.
900;Inadequação dos investimentos por não observar as potencialidades locais.
901;Inadequação na transferência de presos das cadeias municipais para presídios regionais, sem estrutura para garantir a manutenção de vínculos familiares e direitos.
902;Incompletude das ações georreferenciamento e cadastramento para regularização fundiária.
903;Inconsistência na produção de habitação de interesse social e de baixa qualidade.
904;Indefinição do corredor turístico na região.
905;Ineficiente política de assistência estudantil.
906;Ineficiência da atenção básica, gerando altas demandas para as unidades hospitalares.
907;Ineficiência da estrutura do Corpo de Bombeiros para atendimento integral aos municípios.
908;Ineficiência da fiscalização de trânsito na região.
909;Ineficiência da gestão de assistência social.
910;Ineficiência da infraestrutura ambiental.
911;Ineficiência da política de aquisição de alimentos voltados para inserção de produtos da agricultura familiar.
912;Ineficiência da política estadual para imigrantes.
913;Ineficiência da rede de ouvidoria da saúde.
914;Ineficiência das políticas de direitos (negros, LGBT e povos e comunidades tradicionais.
915;Ineficiência das políticas de regularização fundiária.
916;Ineficiência das políticas públicas para adolescente (educação, geração de emprego e renda).
917;Ineficiência de aparelhamento e efetivo na área de segurança pública.
918;Ineficiência de assistência a mulher, ausência de uma delegacia da mulher.
919;Ineficiência de gestão da mata úmida.
920;Ineficiência de policiamento na zona rural.
921;Ineficiência de política de preço mínimo para os produtos da agricultura familiar.
922;Ineficiência de política efetiva de energia renovável.
923;Ineficiência do controle dos recursos ambientais.
924;Ineficiência do sistema de regulação.
925;Ineficiência dos órgãos de controle social.
926;Ineficiência na aplicação das leis e insegurança pessoal.
927;Ineficiência na atenção primária de qualidade.
928;Ineficiência na capacitação contínua humanizada para Agentes da Segurança Pública e Poder Judiciário.
929;Ineficiência na conformação das redes de atenção a saúde.
930;Ineficiência na disponibilidade de pessoas qualificadas nos órgãos públicos para atender as demandas das pessoas com deficiências (visual e auditiva).
931;Ineficiência na execução da política e do Programa de Aquisição de Alimentos (período de execução, liberação de recursos e burocratização).
932;Ineficiência na fiscalização das indústrias.
933;Ineficiência na gestão do território urbano.
934;Ineficiência na investigação criminal que acarreta no atraso das soluções das demandas.
935;Ineficiência na preservação de unidades de conservação.
936;Ineficiência na prestação de serviços socioassistenciais na área rural.
937;Ineficiência na segurança para permanência e atração de agências bancárias.
938;Ineficiência na segurança pública.
939;Ineficiência nas ações de atenção primaria focadas no atendimento materno-infantil.
940;Ineficiência no cadastramento dos recursos hídricos.
941;Ineficácia da limpeza e tratamento de lagoas, rios e canais.
942;Ineficácia das ações de educação ambiental para a população.
944;Ineficácia do acesso à água.
945;Ineficácia dos hospitais para materno-infantil.
946;Inexistência de acompanhamento psicosocial de profissionais do âmbito prisonal.
947;Inexistência de aterro sanitário na região.
948;Inexistência de aterro sanitário.
949;Inexistência de aterros sanitários para destinação adequada do lixo.
950;Inexistência de coleta seletiva, bem como do destino final de descartáveis.
951;Inexistência de equipe multidisciplinar no âmbito do Poder Judiciário, de forma contínua, acarretando sobrecarga das equipes municipais.
952;Inexistência de esgotamento sanitário, afetando o meio ambiente.
953;Inexistência de estratégias de reinserção de presos na sociedade, com foco na capacitação profissional e educacional.
954;Inexistência de estrutura (equipamentos especializados) de atendimento para os segmentos mais vulneráveis.
955;Inexistência de estrutura de saneamento básico.
956;Inexistência de gestão faunística.
957;Inexistência de hospitais-polo na região com ampla abrangência médica e laboratorial.
958;Inexistência de informação por parte dos órgãos de fiscalização do meio ambiente.
959;Inexistência de integração das bacias hidrográficas da região.
960;Inexistência de juízes.
961;Inexistência de planejamento regional de educação ambiental.
962;Inexistência de planejamento urbano para mobilidade social.
963;Inexistência de política consistente de energias renováveis na região.
964;Inexistência de políticas de longo prazo, baseadas em diagnósticos amplos e conectados aos aspectos sociais, econômicos e ambientais.
965;Inexistência de políticas públicas de reconhecimento da utilização dos recursos naturais.
966;Inexistência de rotas turísticas e pouca visibilidade dos pontos turísticos da região.
967;Inexistência de serviços regulares nas delegacias do município.
968;Inexistência de sistema de recursos na região, dificultando o acesso aos veículos comunitários e familiares.
969;Inexistência de sistema de videomonitoramento na região.
970;Inexistência de uma política estadual de assistência estudantil.
971;Inexistência de unidades de bombeiros em outros municípios da região.
972;Inexistência de unidades de conservação.
973;Inexistência de órgãos de pesquisa para agricultura e laboratórios de análise para setor.
974;Inexistência dos serviços de defensoria pública.
975;Infraestrutura com baixa acessibilidade.
976;Infraestrutura de saúde deficitária.
977;Infraestrutura deficiente das escolas.
978;Infraestrutura deficiente na área tecnológica nas escolas rurais.
979;Infraestrutura dos conjuntos habitacionais de qualidade inferior comprometendo a segurança e qualidade de vida da população.
980;Infraestrutura e equipamentos das escolas são inadequados.
981;Infraestrutura escolar deficiente.
982;Infraestrutura escolar ineficiente.
983;Infraestrutura inadequada (E.F).
984;Infraestrutura inadequada das escolas municipais.
985;Infraestrutura inadequada nas Escolas de Ensino Médio em Tempo Integral (EEMTI).
986;Infraestrutura precária nas escolas.
987;Infraestrutura tecnológica e laboratorial precária.
988;Infraestrutura urbana não acompanha a produção.
989;Infraestruturas precárias das universidades da região.
990;Infraestutura inadequada dos órgãos públicos para atender as demandas do publico LGBT.
991;Inoperância para a coleta seletiva de lixo.
992;Insatisfação dos professores quanto ao repasse dos recursos do Fundef.
993;Insegurança do produtor rural e da produção (roubo).
994;Insegurança nas escolas para as pessoas surdas e com outras deficiências impedindo a sua participação nas atividades escolares.
995;Insuficiente política de incentivos à aquisição de métodos de irrigação sustentáveis.
996;Insuficiência da assistência técnica e extensão rural e alta rotatividade dos agentes de ater (bolsistas).
997;Insuficiência da diversificação de espaços de aprendizagem e produção de conhecimento.
998;Insuficiência da oferta de serviços relacionados ao esporte e profissionais de educação física.
999;Insuficiência da qualificação dos serviços da atenção pública, tecnologias e equipamentos da atenção especializada.
1000;Insuficiência da regularização fundiária (concessão de documentos).
1001;Insuficiência das instalações físicas das instituições públicas (sala de aula, laboratório etc.).
1002;Insuficiência das políticas de Educação de Jovens e Adultos (EJA).
1003;Insuficiência das políticas de inclusão e atendimento dos alunos com necessidades educacionais especiais.
1004;Insuficiência das políticas de proteção dos recursos hídricos.
458;Desconhecimento das famílias em relação às políticas e serviços relacionadas à Segurança Alimentar e Nutricional e políticas socioassistenciais.
459;Descontinuidade das ações do estado.
460;Descontinuidade das políticas públicas.
461;Descontinuidade do programa de incentivo a produção e comercialização de leite caprino.
462;Descontinuidade e falta de universalização das políticas públicas de agricultura familiar e agronegócio.
463;Descontinuidade, alta rotatividade e vulnerabilidade dos serviços de extensão no campo.
464;Descontrole na captação de água.
465;Descumprimento da lei de utilização dos recursos do Fecop.
466;Desemprego na zona rural e baixa no comércio e crescente criminalização (marginalização do jovem rural).
467;Desenvolvimento insustentável (uso e má distribuição da água, pouco diálogo) na aquicultura, afetando sua cadeia produtiva.
468;Desequilíbrio entre a oferta e a demanda referente ao atendimento de média e alta complexidade.
469;Desequilíbrio na condução dos programas de segurança, priorizando as ações ostensivas em detrimento das ações socioeducativas.
470;Desequilíbrio na demanda de especialistas (exemplo urologista).
471;Desestruturação familiar.
472;Desigualdade da atuação dos agentes de segurança pública nas áreas rural e urbana.
473;Desigualdade na distribuição de projetos.
474;Desigualdade na política de produção.
475;Desinteresse dos órgãos em desenvolver práticas esportivas.
476;Desmatamento descontrolado para produção ilegal de carvão.
477;Desmatamento indiscriminado no meio rural.
478;Desmatamento sem controle.
479;Desmotivação e falta de perspectivas na atividade docente.
480;Desorganização de competências nas execuções de atividades técnicas e desvalorização do profissional que presta o serviço.
481;Desperdício da água potável.
482;Desperdício de água nas estruturas hídricas de distribuição.
483;Desperdício de água.
484;Despreparo de policiais na abordagem ao cidadão.
485;Despreparo dos agentes de segurança no trato com a população vulnerável.
486;Despreparo dos agentes de segurança para enfrentar os problemas atuais de violência.
487;Despreparo dos agentes de segurança pública no trato com as pessoas com deficiência.
488;Despreparo dos servidores das delegacias para o trato com os vulneráveis (mulheres, idosos e LGBT).
489;Despreparo e tratamento diferenciado ao cidadão pela classe social e condições financeiras.
490;Destinação inadequada do lixo.
491;Destinação inadequada dos resíduos sólidos.
492;Destino inadequado dos resíduos sólidos.
493;Desvalorização da cultura.
494;Desvalorização da mão de obra qualificada por parte dos empregadores.
495;Desvalorização dos agentes culturais.
496;Desvalorização dos artistas locais.
497;Desvalorização dos espaços dos sindicatos de produtores da agricultura familiar.
498;Desvalorização dos profissionais da educação.
499;Desvalorização dos profissionais de educação.
500;Desvalorização dos profissionais de segurança pública.
501;Desvalorização e falta de reconhecimento do talento dos artistas locais.
502;Desvinculação de políticas públicas da parte da cultura/educação.
503;Desvio nas estratégias públicas em função dos interesses individuais e partidários.
504;Diferença entre a teoria x prática no que se refere aos direitos humanos e inclusão social.
505;Dificuldade acesso para gestantes de alto risco às maternidades de referencia do Estado.
506;Dificuldade de a atenção primária ordenar o cuidado.
507;Dificuldade de acesso a atenção secundária na saúde bucal.
508;Dificuldade de acesso a exames de média e alta complexidade.
509;Dificuldade de acesso a UTIs.
510;Dificuldade de acesso a água de consumo humano do meio rural.
511;Dificuldade de acesso ao serviço de média e alta complexidade da saúde.
512;Dificuldade de acesso por parte dos produtores a energias renováveis.
513;Dificuldade de acesso à assessoria técnica e gerencial para o agronegócio adequada à sua realidade.
514;Dificuldade de acesso à Educação Básica e Superior.
515;Dificuldade de acesso à água para o consumo humano com qualidade.
516;Dificuldade de acesso à água.
517;Dificuldade de acesso às políticas públicas.
518;Dificuldade de atendimento da rede assistencial.
519;Dificuldade de especialidades médicas em nível terciário na região.
520;Dificuldade de exames complexos e cirurgias eletivas.
521;Dificuldade de fluxo ordenado na rede de atenção à saúde.
522;Dificuldade de inclusão social para os regressos do sistema penitenciário.
523;Dificuldade de inserção dos estudantes no mercado de trabalho.
524;Dificuldade de integração e planejamento deficiente dos setores da economia para realização de negócios.
525;Dificuldade de logística para implantação de prontuários eletrônicos.
526;Dificuldade de regularização/qualidade dos territórios quilombolas.
527;Dificuldade de reinserção de ex-usuários de drogas na sociedade.
528;Dificuldade do acesso da população rural a seus direitos.
529;Dificuldade na assistência farmacêutica com foco na distribuição de medicamentos.
530;Dificuldade no acesso a equipamentos para integrar e afastar os adolescentes e jovens que fazem uso de drogas.
531;Dificuldade no acesso aos instrumentos de captação de recursos.
532;Dificuldade no acesso as linhas de crédito devido sobretudo a burocracia estatal (assentamentos e comunidades rurais).
533;Dificuldades na atuação dos agentes de segurança na execução de ações preventivas junto a população.
534;Dificuldades no acesso a máquinas e implementos agrícolas.
535;Dificuldades no acesso ao crédito para aquicultura e agricultura.
536;Dificuldades no acesso à água para consumo e produção.
537;Dificuldades para comercialização das comunidades difusas.
538;Dificuldades para comercialização direta pelo o produtor rural.
539;Difícil acesso a água potável nas comunidades.
540;Difícil acesso do aluno à escola (infraestrutura viária).
541;Discriminação em relação à população jovem da área rural e urbana da periferia.
542;Distanciamento da universidade dos grupos produtivos.
