543;Distanciamento do sistema de justiça para com a população com a extinção das comarcas.
544;Distanciamento dos grupos vulneráveis em relação aos agentes públicos.
545;Distanciamento entre as IES e o mercado de trabalho.
546;Distanciamento entre CTs do Estado - Etice e universidades e os municípios.
547;Distorção idade-série na Educação Básica.
548;Distância acentuada dos pais na escola de seu filho.
549;Déficit de cobertura de saneamento básico nos municípios da região.
550;Déficit habitacional.
551;Educação básica - ensino fundamental: salas superlotadas, educação descontextualizada, falta de formação dos profissionais, merenda escolar, intolerância alimentar.
552;Educação de jovens e adultos foi esquecida pelo município e pelo estado.
553;Educação do campo: falta qualificação adequada dos profissionais, falta de transportes mais adequados aos alunos.
554;Educação especial carente de profissionais capacitados e infraestrutura para atendimento.
555;Educação especial: falta de acessibilidade e qualificação dos profissionais.
556;Educação família agrícola: modelo atual não atende as necessidades regionais.
557;Educação infantil: falta de infraestrutura e recursos materiais, qualificação profissional, não atende a demanda da região.
558;Educação profissional: não atende a demanda, não atende com cursos de realidade local, dificuldades de formação de parcerias.
559;Educação superior: pouca oferta de cursos, não atende a demanda, cursos limitados.
560;Elevada quantidade de agricultores sem posse da terra.
561;Elevadas taxas de juros para o agronegócio.
562;Elevado numero de crianças de 5 a 8 anos com obesidade e desnutrição.
563;Elevado índice de abandono escolar.
564;Elevado índice de analfabetismo.
565;Elevação da violência em amplo contexto (mulheres, crianças, idosos, LGBTs).
566;Elevação da violência sexual contra crianças e adolescentes (pedofilia).
567;Encarceramento de jovens negros e pobres.
568;Encarceramento em massa da população negra.
569;Encarecimento dos produtos e serviços devido à dificuldade do acesso aos mesmos.
570;Enfraquecimento das instituições e estruturas de assistência técnica.
571;Enfraquecimento no apoio ao desenvolvimento das cadeias produtivas da agropecuária.
572;Equipamentos culturais insuficientes (museus, bibliotecas, equipamentos nas diversas linguagens artísticas).
573;Equipamentos esportivos abandonados.
574;Equipamentos sucateados.
575;Equipamentos tecnológicos desatualizados.
576;Escassez de aparelho público do judiciário (recursos humanos e financeiros).
577;Escassez de condições de acessibilidade para pessoas com deficiência (arquitetura, intérprete e tecnologias assistivas).
578;Escassez de condições de acessibilidade para pessoas com deficiência nas instituições de ensino (arquitetura, intérprete e tecnologias assistivas).
579;Escassez de espaços públicos para práticas esportivas.
580;Escassez de investimentos culturais para deficientes.
581;Escassez de investimentos na política do livro e da leitura.
582;Escassez de leitos de UTI, em especial para os idosos.
583;Escassez de oportunidades de capacitação dos jovens para o primeiro emprego.
584;Escassez de parcerias com iniciativas privadas em Ciência, Tecnologia e Inovação.
585;Escassez de profissionais e de insumos nos serviços de saúde.
586;Escassez de recursos para segurança alimentar e investimentos na agricultura familiar.
587;Escassez de água potável para consumo humano e animal.
588;Escassez de água potável para consumo humano.
589;Escassez e má distribuição de água de qualidade para o consumo humano.
590;Escassez e má qualidade das fontes hídricas.
591;Escolas da educação básica vulneráveis (drogas, doenças psicológicas modernas e outras).
592;Escolas rurais: sucateadas e algumas desativadas, qualificação insuficiente e falta de material.
593;Escolhas inadequadas para distribuição dos recursos e projetos.
594;Espaços urbanos desqualificados (para gerar fluxo econômico) em comunidades locais.
595;Estrutura e atendimento precário do Caps.
596;Estrutura inadequada na saúde.
597;Estruturas de extração de mel fora dos padrões impedindo a certificação dos produtos.
598;Evasão e falha de orientação para ingresso na escola.
599;Evasão escolar.
600;Excesso de burocracia do acesso aos editais de cultura.
601;Excesso de burocracia e lentidão de processos da educação básica.
602;Excesso de burocracia no acesso ao sistema judiciário.
603;Excesso de burocracia para autorização/licenciamento ambiental.
604;Excesso de comercialização dos cursos superiores (por instituições nem sempre reconhecidas legalmente).
605;Excesso de queimadas (falta de controle).
606;Excesso de queimadas e desmatamentos.
607;Existência de burocracia que dificulta o acesso a justiça.
608;Existência de casos latentes de corrupção por agentes públicos.
609;Existência de delegacia da mulher somente em Quixadá, não atendendo as demandas da região como um todo, bem como plantonistas para atendimento 24 horas e finais de semana.
610;Existência de esgotos a céu aberto.
611;Existência de esgotos clandestinos e a céu aberto.
612;Existência de lixões sem tratamento adequado.
613;Existência de número significativo de beneficiados em programas habitacionais adquiridos de forma ilícita.
614;Existência de parte da população sem acesso a alimentação saudável e moradia adequada.
615;Existência de parte da população sem acesso a saneamento
616;Existência de poucas políticas públicas voltadas para inovação tecnológica.
617;Existência de residências inadequadas em meio urbano e rural.
618;Exploração agrária e pecuária de forma convencional degradando o solo recursos naturais.
619;Extinção da fauna e da flora.
620;Extinção de culturas (pecuária e agricultura).
621;Falha da assistência aos assentamentos estaduais. Conflitos entre assentamentos e gestão doa assentamentos.
622;Falha na comunicação e assessoria técnica da demanda dos projetos culturais.
623;Falha na distribuição espacial dos agentes de segurança pública.
624;Falha na escolha e avaliação dos profissionais de ensino superior.
625;Falha na formação docente, que precisa ser repensada.
626;Falha na garantia do acesso ao saneamento básico da população em vulnerabilidade social.
627;Falha na política de assistência estudantil no ensino superior.
628;Falta apoio / transporte para pacientes de hemodiálise e câncer.
629;Falta da garantia ao acesso aos pacientes oncológicos na Santa Casa de Sobral.
630;Falta de acessibilidade em equipamentos públicos e privados para pessoas com deficiência.
631;Falta de acessibilidade nas estruturas física da Justiça.
632;Falta de acessibilidade nas instituições de ensino.
633;Falta de acesso a alimentação especifica para as pessoas com problemas com câncer e outras doenças.
634;Falta de acesso a atividades esportivas.
635;Falta de acesso a cultura (regionalizar as ações que acontecem na capital).
636;Falta de acesso a justiça gratuita (Defensoria).
637;Falta de acesso a terra e a água
638;Falta de acesso das regiões várzea da abelha e da onça na época das chuvas (ilhadas).
639;Falta de acesso à internet nas escolas.
640;Falta de alimentação das crianças em casa.
641;Falta de aparelhamento das comarcas (pessoas e equipamentos adequados).
642;Falta de aplicação das políticas públicas voltadas para mulheres vítimas de violência, com base no índice de feminicídios.
643;Falta de apoio estadual na preservação ambiental.
644;Falta de apoio técnico e financeiro as escolas de família agrícola.
645;Falta de articulação entre as políticas públicas e equipamentos.
646;Falta de assessoria jurídica na regularização fundiária.
647;Falta de atendimento especializado às mulheres vítimas de violência.
648;Falta de atendimento policial humanizado.
649;Falta de atenção à saúde bucal no âmbito terciário.
650;Falta de atenção às diferentes formas de violência para com estudantes e professores na escola, em todos os níveis.
651;Falta de ATEPA (Assistência Técnica e Extensão Pesqueira e Aquícola).
652;Falta de ATER na agricultura familiar.
653;Falta de aterro sanitário.
654;Falta de autonomia financeira da mulher rural.
655;Falta de ações de financiamento para o sistema de saneamento básico.
656;Falta de ações educativas para as queimadas, o desmatamento e uso de insumos poluentes na agropecuária.
657;Falta de base acadêmica dos profissionais de educação profissional.
659;Falta de base acadêmica dos profissionais de educação.
660;Falta de capacitação continuada para profissionais docentes readaptados.
661;Falta de capacitação dos agentes de apoio educacional.
662;Falta de capacitação dos agentes públicos no atendimento a população negra, lgbt, indigena e quilombolas.
663;Falta de coleta seletiva do lixo.
664;Falta de conexão entre os níveis de ensino.
665;Falta de conexão escola x sociedade.
666;Falta de conscientização ambiental da população.
667;Falta de conscientização/incentivo nas ligações domiciliares e redes de esgoto.
668;Falta de consolidação da política de formação continuada dos profissionais de educação básica.
669;Falta de conteúdo humanizado.
670;Falta de controle do uso da água subterrânea.
671;Falta de controle sobre os novos loteamentos.
672;Falta de creches e escolas de tempo integral.
673;Falta de credibilidade jurídica para investimentos no setor.
674;Falta de cultura de preservação e consciência ambiental.
675;Falta de cultura voltada para a comunidade surda.
676;Falta de curso de pós-graduação nas instituições publicas
677;Falta de delegacia especializada para a mulher na região.
678;Falta de delegacias plantonistas nos municípios.
679;Falta de distribuição de sementes de hortaliças e verdura.
680;Falta de divulgação do uso de energias limpas.
681;Falta de editais que abranjam todas as manifestações culturais da região.
683;Falta de efetividade nas políticas de resíduos sólidos.
684;Falta de efetividade no aproveitamento da infraestrutura de saneamento.
685;Falta de elo entre Universidade, empresa e sociedade.
686;Falta de ensino à distância.
687;Falta de equipamento de cultura.
688;Falta de equipamentos culturais nos municípios da região.
689;Falta de equipamentos de tecnologia.
690;Falta de equipamentos e profissionais preparados para conduzir de melhor forma o processo de ensino-aprendizagem para pessoas com deficiência.
691;Falta de equipamentos para funcionamentos da UPA.
692;Falta de equipamentos tecnológicos.
693;Falta de equipamentos, espaços de leitura, acervos, internet e arquivos digitalizados.
694;Falta de escolas de artes para exibição cultural a nível regional.
695;Falta de espaço físico nas escolas para esporte e lazer.
696;Falta de espaço para realização de eventos de esporte e lazer.
697;Falta de espaços públicos informais para arte e cultura.
698;Falta de estação de tratamento do esgoto.
699;Falta de estrutura física, laboratoriais e tecnológica.
700;Falta de estrutura para comercialização dos produtos da agricultura familiar.
701;Falta de estrutura que possibilite análises de água, solos e plantas.
702;Falta de estrutura voltada à acessibilidade para pessoas com deficiência.
703;Falta de estudos que antecedam a criação de novos projetos voltados à agricultura familiar.
704;Falta de estágio remunerado nas EEMTIs.
705;Falta de fiscalização do setor de transporte publico.
706;Falta de fiscalização e acompanhamento do programa de aquisição de alimentos.
708;Falta de fiscalização na aplicabilidade das leis.
709;Falta de fiscalização na degradação do meio ambiente.
710;Falta de fiscalização na política sanitária/agrotóxico.
711;Falta de fiscalização na área da Educação.
712;Falta de fiscalização nas margens do açude de Aracoiaba e rio Choró (desmatamento).
713;Falta de fiscalização nas ruas para acesso de pessoas idosas e com deficiência.
714;Falta de fiscalização no beneficiamento dos defensivos químicos.
715;Falta de formação de professores e intérpretes e tradutores de Libras.
716;Falta de governança no setor turístico, visando aumentar a proposta de valor do cliente.
717;Falta de humanização por parte dos sistemas prisionais.
718;Falta de implementação de políticas públicas.
719;Falta de implementação do sistema de drenagem.
720;Falta de implementação dos planos diretores dos municípios.
721;Falta de incentivo / investimento para uso de energia renovável.
722;Falta de incentivo a universalização das fibras óticas nos municípios.
723;Falta de incentivo ao agricultor (crédito rural / urbano).
724;Falta de incentivo de plantação de orgânicos/alimentação saudável.
725;Falta de incentivo para a dimensão da formação.
726;Falta de incentivo para jovens no campo da inovação científica.
727;Falta de incentivo à microgeração de energia solar.
728;Falta de incentivo às diversas modalidades esportivas.
729;Falta de incentivo às identidades culturais do Cariri.
730;Falta de incentivos na captação de novas indústrias.
731;Falta de incentivos para comercialização e aproveitamento do excedente de produção.
732;Falta de incentivos políticos para o turismo local e pouca integração entre os municípios da região.
733;Falta de inclusão da disciplina de Libras.
734;Falta de inclusão de idosos, pessoas com deficiência, na locomoção por falta de transporte público.
735;Falta de inclusão de negros na esfera social.
736;Falta de indução de uma política de preservação do patrimônio histórico cultural, material e imaterial dos municípios da região.
737;Falta de indústria para o beneficiamento da produção de caju.
738;Falta de informação da população quanto ao trabalho da polícia.
739;Falta de integração com ícones/personalidades em nível nacional/internacional da Indústria 4.0.
740;Falta de integração da ciência, tecnologia e inovação com as cadeias produtivas locais.
741;Falta de integração da política de reconhecimento dos mestres de cultura à política de educação.
743;Falta de integração das políticas públicas.
744;Falta de integração de orientação das técnicas em laboratórios existentes na região.
745;Falta de integração entre a Universidade e os municípios.
746;Falta de integração entre empresas e secretarias municipais e estaduais.
747;Falta de integração entre práticas de esporte e saúde.
748;Falta de interação entre a sociedade e agentes de segurança
749;Falta de interação institucional para tratar a problemática de segurança pública local.
750;Falta de introdução à profissionalização no oitavo e nono ano.
751;Falta de investimento em outras fontes de energia (renováveis).
752;Falta de investimento na educação ambiental.
753;Falta de investimentos no setor aquícola.
754;Falta de investimentos para permanência dos jovens no campo.
755;Falta de liberação de projetos para centro comunitário produtivo.
756;Falta de mercado de trabalho para os alunos que terminam o curso profissional.
757;Falta de máquinas e equipamentos para irrigação.
758;Falta de médicos especialistas.
759;Falta de oferta de água equânime, principalmente na zona rural.
760;Falta de oportunidades para os egressos do ensino profissionalizante.
761;Falta de organização dos diversos produtores em associativismo/cooperativismo.
762;Falta de orientações na prática de atividades agroecológicas e sustentáveis.
763;Falta de parceria entre instituições públicas e privadas de CTI.
764;Falta de parceria entre instituições públicas e privadas.
765;Falta de perspectiva de futuro dos alunos por falta de oportunidade no mercado de trabalho.
766;Falta de pesquisas constantes para a identificação e para formação profissional.
767;Falta de pessoas capacitadas para inclusão dos alunos especiais.
768;Falta de planejamento dos loteamentos.
769;Falta de planejamento nas escolhas dos campi universitários.
770;Falta de planejamento urbano.
771;Falta de política de preços mínimo (sobretudo no preço do leite para o produtor).
772;Falta de política de valorização dos professores em todos os níveis.
773;Falta de política pública ampla para atendimento aos empreendedores e atividades informais.
774;Falta de política pública para criação e produção de abelhas sem ferrão (meliponicultura).
775;Falta de políticas combate ao câncer e de assistência aos pacientes.
776;Falta de políticas de coletas múltiplas seletiva do lixo.
777;Falta de políticas e crédito para culturas agroecológicas/orgânicas.
778;Falta de políticas e oportunidades para os jovens permanecerem no campo.
779;Falta de políticas para combate a violência doméstica / precariedade no atendimento.
780;Falta de políticas publicas efetivas que contemplem a cadeia produtiva da agropecuária.
781;Falta de políticas publicas para população negra.
782;Falta de políticas públicas de assistência ao homem do campo, no período de seca.
783;Falta de políticas públicas de fiscalização e sistemas de punição com relação aos rios e afluentes.
784;Falta de políticas públicas de incentivo ao saneamento básico.
785;Falta de políticas públicas e tecnologia para o reuso de água.
786;Falta de políticas públicas visando o combate a degradação do meio ambiente.
787;Falta de políticas públicas voltada para o abastecimento de água de qualidade.
788;Falta de políticas públicas voltadas para idosos.
789;Falta de políticas públicas voltadas para o lixo eletrônico.
790;Falta de profissionais de urgência e emergência.
791;Falta de profissionais qualificados da área de TIC.
792;Falta de profissionais qualificados para inclusão.
793;Falta de programa de incentivos para os profissionais das ciências agrárias para aquisição de terras e produção).
794;Falta de projeto esportivos para jovens e adolescentes.
795;Falta de projeto multidisciplinar do esporte.
796;Falta de projetos esportivos para pessoas com deficiência.
797;Falta de qualificação policial para atendimento.
798;Falta de reconhecimento e valorização dos talentos dos alunos nas escolas públicas.
799;Falta de recursos humanos e materiais no judiciário.
800;Falta de recursos para a realização da semana pedagógica.
801;Falta de recursos para que instituições possam prestar seus serviços públicos.
802;Falta de regularização fundiária impedindo o acesso aos incentivos (crédito rural).
803;Falta de responsabilidade com o desenvolvimento sustentável.
804;Falta de responsabilidade da família na educação dos filhos.
805;Falta de ressocialização para presos e egressos do sistema prisional.
806;Falta de revitalização dos rios e açudes da região (Rio Salgado).
807;Falta de saneamento básico no meio rural.
808;Falta de saneamento na zona rural.
809;Falta de segurança nas escolas.
810;Falta de segurança nos conjuntos habitacionais com a expulsão da população pelas facções, aumentando o déficit habitacional.
811;Falta de serviço de atenção terciário da saúde bucal.
812;Falta de serviços de auditoria na saúde.
813;Falta de serviços de ações em vigilâncias sanitárias (aterro sanitário).
814;Falta de transparência em relação à lista de cirurgia eletivas.
815;Falta de transporte escolar adequado.
816;Falta de um fundo de cultura nos municípios da região.
817;Falta de um olhar diferenciado para as políticas sociais.
818;Falta de um olhar por parte das indústrias nas questões sociais e ambientais.
819;Falta de um sistema de integração entre produtores do conhecimento de Ciência e Tecnologia na região do Cariri.
820;Falta de um órgão responsável na área de Ciência, Tecnologia e Inovação.
821;Falta de uma gestão democrática na educação.
822;Falta de universidades públicas nas pequenas cidades.
823;Falta de valorização e incentivo no contexto da cultura, considerando as vocações locais.
824;Falta de variedade nas modalidades esportivas nas políticas públicas de esporte e lazer.
825;Falta de visibilidade para os jovens sobre a existência das instituições de ensino superior da região.
826;Falta de áreas verdes na parte urbana da região.
827;Falta de áreas verdes para práticas esportivas e lazer.
828;Falta do hospital universitário.
829;Falta educação ambiental.
830;Falta engajamento familiar na educação do indivíduo.
831;Falta estudo científico para oferecer alternativas de manejo da floresta caatinga (convivência com o semiárido).
832;Falta hospital veterinário.
833;Falta informação, formação e reaproveitamento dos alimentos.
834;Falta ordenamento (limitações) no atracamento das embarcações.
835;Falta política de arborização e reflorestamento.
836;Falta política de manejo arbóreo nas cidades.
837;Falta política pública para população LGBT.
838;Falta políticas de saúde preventiva.
839;Falta Samu na região.
840;Faltam profissionais nas bibliotecas escolares.
841;Famílias com direitos humanos negados, como acesso a terra, água e moradia.
842;Famílias com vínculos fragilizados.
843;Famílias desassistidas em sua integralidade.
844;Famílias em estado de extrema pobreza, alimentando-se apenas uma ou duas vezes por dia.
845;Fechamento de unidades de SINE/IDT na região, dificultando a emissão de documentos necessários a inserção no mercado de trabalho e ocupação de vagas e empregos ofertados.
846;Fechamento do CVT, prejudicando o desenvolvimento local.
847;Financiamento insuficiente.
848;Fiscalização ambiental deficiente.
849;Fiscalização ambiental inadequada.
850;Fiscalização deficiente da atenção primária.
851;Fiscalização deficiente nas licenças dos poços profundos.
852;Fiscalização e gestão insuficiente para uso adequado dos recursos hídricos na produção aquícola e agronegócio.
1397;Regularização fundiária incompleta ou não concluída.
1398;Regularização fundiária ineficiente.
1399;Retirada desordenada de recurso mineral dos rios, das bacias hidrográficas.
1400;Retrocesso, no contexto atual, dos direitos de pessoas vulneráveis.
1401;Salas multisseriadas por faltas de escola.
1402;"Salas super lotadas; distorção idade-série."
1403;Salas superlotadas.
1404;Saúde focada apenas nas situações de doença.
1405;Saúde mental enfraquecida (aumento do número de suicídios).
1407;Setores corrompidos em algumas instituições.
1408;Sistema de drenagem ineficiente e falta de projetos.
1409;Sistema de saúde pouco integrado.
1410;Sistema de segurança publica que não acompanha a demanda.
1411;Sistema viário acabado comprometendo o acesso a área turísticas.
1412;Sobrecarga de trabalho e estresse dos agentes de segurança.
1413;Subfinanciamento da assistência farmacêutica.
1414;Subfinanciamento dos hospitais polos.
1415;Subfinanciamento e subutilização do HRN de acordo com sua capacidade.
1416;Substituição da mão de obra humana pela máquina.
1417;Subutilização da vila olímpica e insuficiência na formação de atletas.
1418;Superlotação do sistema penitenciário impossibilitando a triagem entre presos provisórios e condenados.
1419;Superlotação do sistema prisional na região.
1420;Taxa de ICMS elevada comparada com outros estados.
1421;Taxa de mortalidade alta por fatores externos.
1423;Transporte escolar deficiente.
1424;Transporte escolar inadequado.
1425;Transporte escolar precário.
1426;Tratamento inadequado da água para o consumo humano.
1427;Tratamento não diferenciado da agricultura em relação ao campo.
1428;Tráfego irregular de veículos de grande porte nas rodovias estaduais, destruindo a pavimentação.
1429;Uso abusivo de agrotóxicos na produção agrícola.
1430;Uso abusivo de agrotóxicos, contaminando os recursos hídricos.
1431;Uso abusivo de agrotóxicos.
1432;Uso abusivo de drogas.
1433;Uso abusivo e inadequado de agrotóxicos.
1434;Uso abusivo e indiscriminado de agrotóxicos e insumos agroindustriais.
1435;Uso demasiado de produtos químicos e ausência de pontos de coleta.
1436;Uso desordenado de agrotóxicos.
1437;Uso excessivo e de forma indiscriminada de agrotóxicos e outros insumos químicos industriais.
1438;Uso inadequado de agrotóxicos.
1439;Uso inadequado dos recursos hídricos.
1440;Uso inconsciente, insustentável e desordenado da terra e dos recursos hídricos.
1441;Uso indiscriminado de agrotóxicos na plantação.
1442;Uso indiscriminado de agrotóxicos.
1443;Uso indiscriminado de medicamentos.
1444;Uso indiscriminado e irresponsável de produtos agroquímicos.
1445;Uso insustentável dos recursos naturais.
1446;Uso irracional da água e desperdício pela população e órgãos responsáveis.
1447;Uso irracional das tecnologias de saúde.
1448;Vagas insuficientes para a educação superior.
1449;Vagas insuficientes para cursos de aperfeiçoamento para jovens.
1450;Vazios assistenciais em especialidades médicas.
1451;Vigilância em saúde ineficiente.
1452;Violência nas escolas.
1453;Vulnerabilidade hídrica própria da região.
1454;Água não tratada.
1455;Êxodo rural e poucos incentivos para permanência dos jovens no campo.
1456;Êxodo rural elevado e pouca mão de obra no campo.
1005;Insuficiência de acesso a regularização fundiária (título da terra).
1006;Insuficiência de agentes públicos na área de segurança publica
1007;Insuficiência de assistência material aos detentos.
1008;Insuficiência de atendimentos equipamentos socioassistenciais.
1009;Insuficiência de ações para crianças em situação de trabalho infantil.
1010;Insuficiência de cursos profissionalizantes de curta duração.
1011;Insuficiência de dados (levantamento de dados) em todos os seguimentos para tomadas de decisões.
1012;Insuficiência de delegacias de segurança pública no Sertão de Sobral.
