233;Baixa resolução nos casos que entra nas delegacias (policia investigativa).
234;Baixa sustentabilidade no desenvolvimento econômico devido à dilapidação do patrimônio natural.
235;Baixa valorização da atividade de pesca artesanal.
236;Baixa valorização dos profissionais da educação.
237;Baixo apoio ao cooperativismo e associativismo.
238;Baixo apoio do estado na construção de abatedouros nos municípios da região.
239;Baixo apoio estadual na infraestrutura dos municípios na geração de empregos.
240;Baixo apoio para o acesso aos recursos hídricos para produção e consumo.
241;Baixo aproveitamento da água da chuva.
242;Baixo aproveitamento de outras fontes de energia sustentável (eólica e solar).
243;Baixo conhecimento da importância da segurança alimentar.
244;Baixo conhecimento dos usuários sobre garantia de direitos e os equipamentos de assistência social.
245;"Baixo conhecimento e ""preconceito"" em relação às atividades da carcinicultura."
246;Baixo conhecimento e capacitação dos indivíduos para mudanças de realidades.
247;Baixo conhecimento para acesso as plataformas e tecnologias por parte da sociedade em geral.
248;Baixo efetividade das políticas de acesso a terra na região.
249;Baixo efetivo de agentes da Segurança Pública.
250;Baixo efetivo de policiamento na região.
251;Baixo efetivo dos agentes de segurança para atender a área rural e urbana.
252;Baixo efetivo para atendimento na zona urbana e rural.
253;Baixo estímulo para atração de novas indústrias para geração de empregos, melhoria da eficiência e acesso a novas tecnologias.
254;Baixo estímulo para produção sustentável e agroecológica no semiárido.
255;Baixo grau de atuação e organização em associativismo e cooperativismo e redes de produtores.
256;Baixo incentivo da melhoria da política de irrigação.
257;Baixo incentivo para o desenvolvimento do turismo rural.
258;Baixo incentivo para o turismo.
259;Baixo incentivo para projetos de cultura e arte.
260;Baixo incentivo à ciência e produção.
261;Baixo incentivo à inovação.
262;Baixo incentivo à pesquisa voltada para realidade local.
263;Baixo incentivo à prática de esportes nas universidades.
264;Baixo incentivo às cooperativas e associações para o acesso a comercialização.
265;Baixo investimento / incentivo para o setor tecnológico local.
266;Baixo investimento dos órgãos públicos em apoio às associações comunitárias que trabalham na agricultura familiar.
267;Baixo investimento e baixo custeio nas instituições de ensino superior a partir do ano de 2014.
269;Baixo investimento em cultura e turismo local e regional, fomentando os saberes e fazeres dos agentes, grupos e órgãos gestores municipais.
270;Baixo investimento em editais e demais instrumentos de apoio à geração de negócios voltados para a Ciência, Tecnologia e Inovação.
271;Baixo investimento em mobilidade nas rodovias estaduais.
272;Baixo investimento na atenção primária.
273;Baixo investimento nas escolas de tempo integral do ensino fundamental.
274;Baixo investimento nas políticas culturais, especialmente na Cultura Viva.
275;Baixo investimento nos Centros Vocacionais Tecnológicos (CVT).
276;Baixo nível de associativismo e cooperativismo.
277;Baixo nível de atendimento do programa de distribuição de sementes.
278;Baixo nível de informações e estímulo aos produtores de tecnologias alternativas para o processo de produção agroecológica.
279;Baixo nível de regularização fundiária na região.
280;Baixo nível educacional do agricultor no uso de tecnologias.
281;Baixo nível educacional dos atores.
282;Baixo nível tecnológico para o agronegócio de nível médio.
283;Baixo número de cursos na universidade pública.
284;Baixo número de leitos de UTI (adulto e pediátrico) nos hospitais terciários.
285;Baixo percentual de investimento em saúde.
286;Baixo uso de tecnologia na dinâmica ensino-aprendizagem.
287;Baixo índice de adoção de tecnologias alternativas de base agroecológica e adaptação à agricultura familiar.
288;Baixo índice de cobertura de saneamento básico.
289;Baixos incentivos ao desenvolvimento das atividades agropecuária e aos pequenos negócios.
290;Baixos incentivos aos grupos produtivos da agricultura familiar (jovens, mulheres).
291;Baixos incentivos e atrativos para surgimento de pequenas e médias indústrias.
292;Baixos incentivos nas explorações extrativistas.
293;Baixos incentivos para agregar valores aos produtos da agricultura familiar.
294;Baixos incentivos para agroecologia.
295;Baixos incentivos tecnológicos para pesca e aquicultura.
296;Baixos incentivos à produção agrícola.
297;Baixos incentivos, atrativos e vias de acesso para o desenvolvimento do turismo da região.
298;Baixos investimento na captação e armazenamento hídrico na região.
299;Baixos investimentos e ausência de plano de médio e longo prazo para o desenvolvimento da agricultura familiar e suas organizações.
300;Baixos investimentos em infraestutura e ausência de projetos na aquicultura familiar e pesca artesanal.
301;Baixos investimentos em políticas de atração em indústrias para região.
302;Baixos investimentos para produção com foco nas mulheres e jovens do campo, levando ao êxodo rural.
303;Baixos subsídios para agricultura familiar.
304;Barramento ilegal no leito dos rios.
305;Burocracia ao acesso as linhas de crédito para a produção.
306;Burocracia estatal dificultando a formalização de produtores e empreendedores.
307;Burocratização dos órgãos estatais na liberação da licença ambiental para exploração da terra.
308;Burocratização dos órgãos estatais para o acesso do crédito rural.
309;Burocratização no acesso ao crédito rural.
310;Burocratização nos editais de incentivo.
311;Burocratização nos processos do programa de aquisição de alimentos.
312;Capacitação insuficiente em gestão em turismo.
313;Carência da infraestrutura viária rural (dificuldade de escoamento da produção).
314;Carência de academias nos espaços públicos.
315;Carência de assistência social aos grupos familiares vulneráveis.
316;Carência de atendimento na área materno-infantil.
317;Carência de educação ambiental.
318;Carência de eficiência das estações de tratamento de esgoto existentes.
319;Carência de equipamentos adequados para prática de esporte.
320;Carência de gerenciamento de resíduos sólidos.
321;Carência de habitação adequada urbana e rural.
322;Carência de incentivo do Estado ao estabelecimento dos Planos de Saneamento Municipais.
323;Carência de incentivos a projetos esportivos.
324;Carência de investimento em equipamentos e profissionais para qualificar as práticas de esportes e lazer, treinamento de atletas, campeonatos regionais.
325;Carência de médicos para atendimento à população.
326;Carência de política de esporte e lazer para a população idosa.
327;Carência de políticas de esporte e lazer na região.
328;Carência de políticas públicas para a inclusão dos jovens no mercado de trabalho.
329;Carência de políticas públicas para fixação do jovem rural no campo.
330;Carência de professores efetivos nas Instituições de Ensino Superior (IES) estaduais.
331;Carência de recursos humanos nos equipamentos de esporte e lazer.
332;Carência de recursos para esporte, lazer e cultura.
333;Carência de saneamento básico nos espaços rurais e, em uma grande maioria da zona urbana, em muitos lugares a população utiliza fossa séptica.
334;Carência de serviços de pronto atendimento de acidentes diversos no meio rural.
335;Carência de transporte e infraestrutura viária às escolas.
336;Carência de uma qualificação de profissionais para fazer uma abordagem a pessoas LGBT.
337;Carência de vagas nas escolas profissionalizantes.
338;Carência do profissional de saúde bucal.
339;Carência na certificação dos produtos da agricultura familiar.
340;Carência na conexão da política de esporte e lazer com os costumes da região.
341;Carência na oferta de cursos de formação nas áreas agrárias/artesão, de acordo com as potencialidades locais.
342;Carência na proteção dos corpos hídricos(lagos e lagoas).
343;Casos de abuso de poder por parte de agentes públicos de segurança.
344;Casos de pouca inclusão de pessoas com necessidades especiais.
345;Casos de trabalho infantil.
346;Centralização de políticas públicas no município de Sobral.
347;Centralização de programas sociais em Sobral, desassistindo os outros municípios.
348;Centralização de programas voltados para crianças e adolescentes.
349;Centralização dos equipamentos da assistência social na área urbana deixando a área rural sem nenhum equipamento.
350;Centralização dos investimentos em segurança pública em Sobral.
351;Centralização dos projetos de habitação.
352;Centralização e priorização dos investimentos nos grandes municípios em detrimento dos pequenos.
353;Centralização no município de Sobral da infraestrutura viária.
354;Centralização nos investimentos e promoção apenas no turismo sol e praia (priorizando canoa quebrada).
355;Chorume gerado pelo lixão de Aracati chega ao rio Jaguaribe.
356;Cidades da região com planos diretores defasados.
357;Coleta de lixo inadequada.
358;Coleta de lixo seletiva ainda incipiente.
359;Coleta e destinação inadequada de resíduos sólidos (lixos a céu aberto).
360;Comprometimento dos recursos hídricos por exploração e comercialização inadequadas.
361;Comprometimento na abrangência da infraestrutura de energia.
362;Comércio dependente da folha de pagamento da prefeitura.
363;Concentração da oferta de ensino superior.
364;Concentração da terra e meios de produção (recursos hídricos) nas mãos dos grandes latifundiários.
365;Concentração de indústrias na RMF, em detrimento de outros municípios.
366;Concentração dos investimentos em Juazeiro do Norte, afetando o desenvolvimento dos demais municípios da Região.
367;Concentração social e espacial da riqueza.
368;Conflitos de facções.
369;Conhecimento insuficiente dos investimentos de gestão / legislação dos recursos hídricos.
370;Contaminação da água e do solo por conta da utilização de agrotóxicos.
371;Contaminação dos recursos hídricos pela destinação inadequada de resíduos e efluentes.
372;CRAS com estrutura inadequada para o atendimento aos usuários.
373;Cultura de sonegação de tributos elevada (comércio e serviço).
374;Currículo descontextualizado com a questão de gênero.
375;Currículo descontextualizados com a atualidade.
376;Currículo enxuto voltado somente para português e matemática.
377;Currículo escolar defasado.
378;Currículo escolar pouco atraente.
379;Currículos não voltados para inovação.
380;Curto período de execução dos programas PAA e PNAE.
381;Curto período para execução do Programa de Aquisição de Alimentos ¿ Compra com Doação Simultânea (PAA-CDS).
382;Declínio gradativo nos investimentos na educação superior.
383;Deficiência da equipe mínima responsável pelos serviços socioassistenciais.
384;Deficiência da instrumentalização virtual.
385;Deficiência da logística do campo.
386;Deficiência da política de inclusão social no que diz respeito à avaliação e controle necessário para priorização do acesso dos grupos vulneráveis e/ou PCD.
1;A geração de energia renovável não vem gerando redução nos custos.
2;A maioria das pessoas que estão em distorção a idade/série são negros.
3;Abertura de universidades privadas sem a devida capacitação profissional.
4;Abordagem de agentes públicos com o uso indevido da força, sobretudo em relação a negros e LGBTs.
5;Abordagem preconceituosa dos agentes de segurança em relação às populações vulneráveis.
7;Acessibilidade ineficiente.
8;Acesso desigual a uma educação de qualidade, contextualizada numa perspectiva inclusiva em todos os níveis de ensino.
9;Acesso precário aos serviços na atenção da média e alta complexidade.
10;Acesso reduzido às populações de poder aquisitivo baixo ao serviço de saúde.
11;Acesso restrito dos profissionais da cultura nas instituições de ensino básico.
12;Aculturação do povo nativo.
13;Adoecimento dos estudantes e professores por problemas emocionais.
14;Adoecimento dos profissionais do âmbito prisional.
15;Alta burocratização para o acesso ao crédito rural.
17;Alta demanda de saúde mental (problemas socioemocionais e vulnerabilidade social) na escola.
18;Alta distorção idade/série.
19;Alta mortalidade materna e infantil.
20;Alta rotatividade de juízes, procuradores e defensores públicos (insuficiência).
21;Alta rotatividade dos técnicos prestadores de assistência técnica e extensão rural devido a forma de contratação.
22;Alta taxa de acidentes decorrentes por motocicletas.
24;Alta taxa de suicídio decorrente da carência da assistência social.
25;Alta taxação de forma desregrada e cobrança antecipada de ICMS.
26;Alto consumo de produtos contaminados com agrotóxicos.
27;Alto custo dos insumos para produção agropecuária.
28;Alto custo para o cidadão utilizar as energias renováveis.
29;Alto custo para produção com crescente descapitalização dos produtores.
30;Alto número de jovens na ociosidade, devido a falta de oportunidade na educação e baixo incentivo.
31;Alto uso de agrotóxicos e baixa divulgação de tecnologias alternativas.
32;Alto uso de agrotóxicos.
33;Alto índice de acidentes automobilísticos na região.
34;Alto índice de acidentes de trânsito nas áreas urbanas e rurais.
35;Alto índice de alunos envolvidos com drogas/prostituição.
36;Alto índice de analfabetos funcionais.
38;Alto índice de desemprego.
39;Alto índice de gravidez na infância e adolescência.
40;Alto índice de incidência de jovens em cumprimento de medidas socioeducativas, com baixo índice de socialização.
41;Alto índice de sedentarismo.
42;Alto índice de violência no meio rural, dificultando o escoamento da produção.
43;Ambientes públicos com pouca oferta de espaços de lazer (praças esportivas).
44;Ameaça ao uso racional dos recursos hídricos.
45;Ampliação das áreas urbanas em detrimento de áreas rurais.
46;Aperfeiçoamento do ensino, capacitação dos professores (mestrado e doutorado).
47;Apoio insuficiente ao desenvolvimento de ações culturais e esportivas.
48;Apoio insuficiente em tecnologias sociais.
49;Apoio logístico as visitas técnicas insuficiente.
50;Apoio à energia sustentável, em detrimento as energias limpas.
51;Articulação fraca dos agentes de segurança com as demais políticas de combate ao tráfico de drogas.
52;Assistência social pouco valorizada e poucos recursos financeiros.
53;Assistência técnica e extensão rural ineficiente, insuficiente e descontinuada.
54;Assistência técnica e extensão rural insuficiente e descontinuada para agricultura familiares, assentamentos, reassentamentos, povos e comunidades tradicionais.
55;Assistência técnica insuficiente, ineficiente e descontinuada.
56;Assoreamento dos rios, riachos e reservatórios.
57;Atendimento aos usuários não é suficiente, as demandas humanizadas deficiente, ausência de profissionais especializados, deficiência na assistência farmacêutica.
58;Atendimento inadequado ás mulheres vítimas de violência, idosos e crianças.
59;Atendimento incorreto referente à política de humanização.
60;Atenção precária á saúde do trabalhador.
61;Atenção primária na saúde com baixa resolutividade.
62;Atitudes ostensivas e desumanas na transferência dos detentos para outra localidade.
63;Aumento da criminalidade dos jovens.
64;Aumento da criminalidade na juventude urbana e rural.
65;Aumento da criminalidade por falta de emprego.
66;Aumento da insegurança no meio rural.
67;Aumento da mendicância e do trabalho infantil.
68;Aumento da obesidade em todas as faixas etárias pela alimentação inadequada e ultraprocessada.
69;Aumento da população de rua, fragilidade dos vínculos familiares e aumento da violência contra idosos.
70;Aumento da população usuária de substâncias psicoativas.
71;Aumento da população usuária de álcool e drogas.
72;Aumento da violência contra a mulher, em especial na área rural.
73;Aumento da violência contra os grupos mais vulneráveis (mulheres, adolescentes, LGBT, idosos e negros).
74;Aumento da violência na região, tanto na área urbana quanto rural.
75;Aumento da violência nos municípios do Vale do Jaguaribe.
76;Aumento da violência à pessoa idosa.
77;Aumento das facções criminosas e da insegurança nas pequenas e grandes cidades, inclusive na zona rural.
78;Aumento de mortes prematuras por doenças não transmissíveis.
79;Aumento do consumo de drogas entre os jovens.
80;Aumento do custo de vida local motivado pelo aumento do fluxo do turismo.
81;Aumento do déficit habitacional.
82;Aumento do genocídio, feminicídio, LGBTfobia, jovens da periferia, idosos, povos e comunidades tradicionais em todo o estado do Ceará.
83;Aumento do número da obesidade infantil (0 a 5 anos).
84;Aumento do número de assaltos.
85;Aumento do número de usuários de drogas.
86;Aumento dos usuários de drogas.
87;Ausência / deficiência do abastecimento de água para o consumo humano.
88;Ausência da delegacia da mulher na região.
89;Ausência da disciplina de educação ambiental na rede de ensino.
90;Ausência da prestação de serviços de esgotamento sanitário.
91;Ausência da residência universitária.
92;Ausência de alternativas para as populações rurais para ter o acesso ao saneamento rural.
93;Ausência de assistência técnica e extensão pesqueira e aquícola.
94;Ausência de assistência técnica e extensão rural nos assentamentos, comunidades e povos tradicionais.
95;Ausência de atendimento especializado a criança e adolescente na área da segurança na área rural.
96;Ausência de ações permanentes para formação cidadã dos estudantes.
97;Ausência de campus universitário nas cidades menores da região dos Inhamuns.
98;Ausência de capacitação para alguns serviços da área socioassistenciais (SICON e SISC).
99;Ausência de controle da qualidade da água do Rio Jaguaribe.
100;Ausência de cooperação técnica entre as instituições de ensino publica e privado voltado para a região.
101;Ausência de cursos de mestrado e doutorado na região.
102;Ausência de cursos preparatórios para ingresso ao ensino superior.
103;Ausência de Defensor Público nos municípios.
104;Ausência de defensores públicos na maioria dos municípios, além da má distribuição das varas para juízes e promotores.
105;Ausência de delegacia especializada para atendimento a mulher e de centros de referência.
106;Ausência de delegacias de plantão noturno e fim de semana, principalmente na Delegacia da Mulher e regional.
107;Ausência de educação contextualizada na área rural.
108;Ausência de energia solar nos prédios públicos.
109;Ausência de equipamentos culturais na região.
110;Ausência de equipamentos para prática esportiva de forma segura.
111;Ausência de espaço humanizado para abrigar jovens infratores.
112;Ausência de espaços para comercialização dos produtos da agricultura familiar.
113;Ausência de fiscalização das instituições de ensino privada.
114;Ausência de fontes alternativas de energias renováveis.
115;Ausência de formação continuada para os professores, gestores e secretários escolares.
116;Ausência de formação para servidores dos quadros técnico-administrativos da educação.
117;Ausência de gestão ambiental em alguns municípios.
118;Ausência de gestão de resíduos sólidos / coleta seletiva e aterros sanitários.
119;Ausência de gestão faunística.
120;Ausência de gestão integrada para preservação dos recursos naturais.
121;Ausência de incentivo para o aproveitamento das fontes de energias limpas.
122;Ausência de incentivos a agroindústria.
123;Ausência de incentivos aos profissionais da atenção primária de saúde.
124;Ausência de indústria para o beneficiamento dos produtos pesqueiros.
125;Ausência de iniciativas que aproximem a sociedade para as questões de segurança.
126;Ausência de investimento na infraestrutura.
127;Ausência de investimentos e valorização nos projetos culturais.
128;Ausência de manejo dos resíduos sólidos.
129;Ausência de manutenção dos equipamentos.
130;Ausência de medidas estratégicas contínuas para conviver com a seca.
131;Ausência de moradias para população carente.
132;Ausência de oferta pública de energias renováveis.
133;Ausência de perícia forense.
134;Ausência de plano de manejo nas unidades de conservação.
135;Ausência de plano de mobilidade urbana para todos os municípios.
136;Ausência de policiamento nos assentamento e comunidades rurais.
137;Ausência de política de comunicação de difusão do conhecimento através dos meios de comunicação do Estado e da mídia alternativa popular.
138;Ausência de política estadual de habitação para a população de baixa renda.
139;Ausência de políticas de alimentação saudável nas escolas para diminuir doenças crônicas.
140;Ausência de políticas de proteção / recuperação dos rios.
141;Ausência de políticas de reflorestamento.
142;Ausência de políticas de reuso da água.
143;Ausência de políticas de transporte para os estudantes do ensino superior.
144;Ausência de políticas estaduais de aquisição e disponibilização de grãos para alimentação animal.
145;Ausência de políticas publicas para atender crianças de 0 a 3 anos
146;Ausência de políticas públicas de acesso a terra pela governo do estado.
147;Ausência de políticas públicas para extinguir o analfabetismo digital.
148;Ausência de políticas públicas para incentivo à energia solar.
149;Ausência de políticas públicas visando gestão e uso racional dos recursos hídricos.
150;Ausência de pontualidade no repasse dos recursos do cofinanciamento da assistência.
151;Ausência de profissionais na área de apoio ao estudante - psicólogos, assistente social etc.
152;Ausência de profissionais nas academias nos espaços públicos.
153;Ausência de programa de uso de água para irrigação.
154;Ausência de programas de fomento à arte e à cultura e à transformação social.
155;Ausência de qualificação profissional para público em geral da região.
156;Ausência de recursos financeiros e humanos direcionados ao esporte e lazer.
157;Ausência de registros dos imóveis.
158;Ausência de rotas turísticas, pouco incentivo e promoção dos destinos com foco nas suas regionalidades e turismo rural.
159;Ausência de saneamento básico.
160;Ausência de saúde alternativa (farmácia viva, fototerápico).
161;Ausência de segurança ostensiva.
162;Ausência de serviços especializados de saúde.
163;Ausência de tecnologia na construção civil para projetos de energia sustentáveis.
164;Ausência de transporte público para alunos do ensino superior.
165;Ausência de um atendimento especializado à mulher em situação de violência.
166;Ausência de um centro para comercialização e distribuição dos produtos da agricultura familiar.
167;Ausência de uma campanha naturalizadora de aceitação social.
168;Ausência de uma legislação que promova a atração de empresas detentoras da tecnologia de energias renováveis.
169;Ausência de uma unidade do Corpo de Bombeiros.
170;Ausência de unidades de corpo de bombeiros (só existe uma unidade em Sobral).
171;Ausência de valorização da cultura local e regional.
172;Ausência do estado na gestão dos consórcios públicos em saúde.
173;Ausência do município de Icó no roteiro cultural e turístico.
174;Ausência dos centros de zoonoses regionais.
175;Ausência, por parte do estado, de profissionais (assistente sociais e psicólogos) para dar suporte à justiça.
176;Avanço da desertificação na região.
177;Avanço da ocupação das áreas do mangue e aluvião pelas atividades econômicas.
178;Avanço indiscriminado do agronegócio em detrimento da agricultura familiar.
179;Baixa aplicação de leis dos Direitos Humanos.
180;Baixa articulação do governo do estado e municípios para programas de convivência com o semiárido.
181;Baixa articulação entre as setoriais para aquisição dos produtos da agricultura familiar.
182;Baixa atividade cultural nas escolas.
183;Baixa capacitação de pessoas dentro do ambiente regulatório envolvendo a Ciência, Tecnologia e Inovação.
184;Baixa capacitação do produtor para produzir mais com menos custos.
185;Baixa capacitação dos jovens residentes no meio rural.
186;Baixa capacitação para relações étnico-raciais.
187;Baixa cobertura de saneamento básico.
188;Baixa cobertura do saneamento básico.
189;Baixa cobertura e baixa eficiência do programas sociais.
190;Baixa cobertura e ineficiência dos serviços de saneamento básico na região.
191;Baixa conscientização da população quanto ao uso racional da água.
192;Baixa consciência sobre a sustentabilidade na relação entre agricultores e os espaços onde vive.
193;Baixa disponibilidade de medicamentos compactuados no SUS.
194;Baixa educação em políticas de sustentabilidade para o processo de transição agroecológica.
195;Baixa escolaridade dos agricultores.
196;Baixa exploração dos potenciais turísticos da região.
197;Baixa fiscalização nas atividades de carcinicultura.
198;Baixa fiscalização nas compras governamentais.
199;Baixa fiscalização para o meio ambiente (sustentabilidade).
200;Baixa fiscalização por parte do estado na comercialização dos produtos da agricultura familiar (produtor refém do atravessador).
201;Baixa fiscalização às empresas que fazem os serviços de transporte coletivos intermunicipais.
202;Baixa fixação dos produtores e agricultores assentados no campo.
